{
  "schema_version": "1.0",
  "reviewer": {
    "kind": "ai-agent-vision",
    "name": "app-store-review-agent",
    "model_or_role": "multimodal release reviewer"
  },
  "reviewed_at": "2026-08-25T00:00:00Z",
  "scope": {
    "source_queue": "review-output/contact-sheets/visual-review-queue.json",
    "reviewed_originals": false,
    "reviewed_contact_sheets": false
  },
  "screens": [
    {
      "path": "en-US/iphone-6.9/01-home.png",
      "verdict": "NEEDS_REVIEW",
      "observations": [
        "Replace this placeholder with observations from the exact full-resolution release screenshot."
      ],
      "claims_observed": [],
      "sensitive_data_observed": []
    }
  ],
  "checks": [
    {
      "id": "screenshots.visual",
      "title": "Agent visual review of every submitted screenshot",
      "status": "NEEDS_REVIEW",
      "mandatory": true,
      "detail": "Template only. Review every original and locale before changing this status.",
      "tool": "ai-agent-vision",
      "evidence": []
    }
  ],
  "findings": [],
  "facts": {
    "all_originals_reviewed": false,
    "all_locales_reviewed": false
  }
}
