{
  "schema_version": "1.0",
  "reviewer": {
    "kind": "ai-agent-vision",
    "name": "fixture-vision-reviewer",
    "model_or_role": "full-resolution test fixture"
  },
  "reviewed_at": "2026-08-25T00:00:00Z",
  "scope": {
    "source_queue": "tests/fixtures/contact-sheets/visual-review-queue.json",
    "reviewed_originals": true,
    "reviewed_contact_sheets": true
  },
  "screens": [
    {
      "path": "en-US/iphone-6.9/01-home.png",
      "sha256": "db1acb8491f319245fd75a1c47ef6f6005ba83c7046721abc81b96ad6c7ad5c1",
      "verdict": "PASS",
      "observations": [
        "Actual app workflow is visible",
        "No clipping, placeholder data, or private data is visible"
      ],
      "claims_observed": [
        "Create a release-ready project"
      ],
      "sensitive_data_observed": []
    }
  ],
  "checks": [
    {
      "id": "screenshots.visual",
      "title": "Agent visual review of every submitted screenshot",
      "status": "PASS",
      "mandatory": true,
      "detail": "Every original was inspected at full resolution and matched to the fixture build.",
      "tool": "ai-agent-vision",
      "evidence": [
        {
          "kind": "screenshot",
          "location": "en-US/iphone-6.9/01-home.png",
          "detail": "Full-resolution visual inspection"
        }
      ]
    }
  ],
  "findings": [],
  "facts": {
    "all_originals_reviewed": true,
    "all_locales_reviewed": true
  }
}
